{
  "schemaVersion": 1,
  "slug": "clipforge-ai",
  "seo": {
    "title": "ClipForge AI Review (2026): Score, OTOs & Bonuses | StackPiston",
    "description": "The fastest way we tested to turn blog posts into faceless short-form videos. Get the front end; most upsells are optional."
  },
  "product": {
    "name": "ClipForge AI",
    "vendor": "Northlane Digital",
    "niche": "AI Video",
    "summary": "ClipForge AI is a cloud app that turns a URL, script or keyword into a captioned vertical video with stock footage, AI voiceover and music. It targets marketers who want to post on TikTok, Reels and Shorts without filming themselves.",
    "refundDays": 30,
    "platform": "JVZoo"
  },
  "launch": {
    "cartOpen": "2026-10-07T15:00:00Z",
    "cartClose": "2026-10-14T03:59:00Z",
    "timezoneLabel": "EDT",
    "timeZone": "America/New_York"
  },
  "review": {
    "label": "Recommended",
    "verdict": "The fastest way we tested to turn blog posts into faceless short-form videos. Get the front end; most upsells are optional.",
    "finalVerdict": "Good value at $17. Buy the front end and add Unlimited only if you post daily.",
    "methodNote": "We bought the front end and every upsell on launch day and ran it for a week on a real project. Everything below comes from our own account.",
    "trustBadge": "Bought & tested",
    "testedNote": "tested 7 days",
    "publishedAt": "2026-10-05",
    "updatedAt": "2026-10-05",
    "author": "marcus",
    "scoreBreakdown": [
      {
        "label": "Ease of use",
        "score": 9.1
      },
      {
        "label": "Features",
        "score": 8.2
      },
      {
        "label": "Output quality",
        "score": 7.9
      },
      {
        "label": "Value for money",
        "score": 8.8
      },
      {
        "label": "Support",
        "score": 7.8
      }
    ],
    "score": 8.4
  },
  "media": {
    "type": "video",
    "videoUrl": "",
    "videoTitle": "ClipForge AI demo · 6:42",
    "screenshotUrl": ""
  },
  "links": {
    "frontEnd": "https://jvz1.com/c/123456/clipforge-ai",
    "bonusPage": "bonus/clipforge-ai"
  },
  "pricing": {
    "frontEnd": {
      "name": "ClipForge AI Commercial",
      "price": 17,
      "priceAfterLaunch": 47,
      "priceType": "one-time",
      "items": [
        "Full app + commercial rights"
      ],
      "note": "Everything you need to get results. Our bonuses attach to this."
    },
    "otos": [
      {
        "name": "Unlimited",
        "price": 47,
        "items": [
          "Unlimited renders",
          "4K export + priority queue"
        ],
        "verdict": "worth_it",
        "note": "Removes the 50/month cap. Buy if you post daily.",
        "link": "https://jvz1.com/c/123456/clipforge-ai/oto1",
        "summary": "Removes the 50-renders-per-month cap on the front end and moves your jobs to a priority render queue. It also unlocks 4K export and videos up to 10 minutes.",
        "included": [
          "Unlimited renders per month",
          "Priority render queue (about 2× faster in our tests)",
          "4K export",
          "Videos up to 10 minutes (front end caps at 3)",
          "Bulk create up to 20 videos at once"
        ],
        "pros": [
          "Bulk mode saves real time",
          "Queue was noticeably faster on launch day"
        ],
        "cons": [
          "Post-launch pricing isn't stated on the sales page"
        ],
        "score": 8.6,
        "downsell": {
          "name": "Unlimited Lite",
          "price": 27,
          "note": "Unlimited renders, no 4K"
        },
        "takeaway": "We hit the 50-render cap on day four. If you plan to post daily on more than one platform, this is the upgrade that matters most. If you decline, the $27 downsell keeps unlimited renders and drops 4K."
      },
      {
        "name": "DFY Templates",
        "price": 37,
        "items": [
          "300 niche templates",
          "Monthly template drops"
        ],
        "verdict": "optional",
        "note": "Saves time, but the included templates are enough to start.",
        "link": "https://jvz1.com/c/123456/clipforge-ai/oto2",
        "summary": "A library of 300 pre-built video templates across 25 niches, with new packs added monthly for 12 months.",
        "included": [
          "300 templates in 25 niches",
          "Monthly template drops for 12 months",
          "40 animated caption styles",
          "Intro and outro packs"
        ],
        "pros": [
          "Templates look current",
          "Easy to customize"
        ],
        "cons": [
          "Several niches overlap",
          "Monthly drops are unproven"
        ],
        "score": 7.4,
        "takeaway": "Good templates, but the front end's 40 are enough to start. Buy later if you find yourself rebuilding the same layouts."
      },
      {
        "name": "Agency License",
        "price": 67,
        "items": [
          "Sell videos to 100 clients",
          "Client dashboard"
        ],
        "verdict": "optional",
        "note": "Only if you already have paying clients.",
        "link": "https://jvz1.com/c/123456/clipforge-ai/oto3",
        "summary": "Lets you sell videos made with ClipForge to clients and adds a client dashboard where each client gets their own workspace.",
        "included": [
          "Commercial license for 100 clients",
          "Client workspaces with separate brand kits",
          "Client approval links",
          "Agency marketing materials"
        ],
        "pros": [
          "Approval links save back-and-forth",
          "Separate brand kit per client"
        ],
        "cons": [
          "Marketing materials are generic",
          "Clients can't log in themselves"
        ],
        "score": 7.2,
        "takeaway": "Useful only if you have clients or are actively finding them. The front end already covers commercial use for your own business."
      },
      {
        "name": "AI Voice Pro",
        "price": 27,
        "items": [
          "80 premium voices",
          "Voice cloning"
        ],
        "verdict": "worth_it",
        "note": "The base voices are robotic. This fixes the biggest weakness.",
        "link": "https://jvz1.com/c/123456/clipforge-ai/oto4",
        "summary": "Replaces the front end's 12 standard voices with 80 premium AI voices and adds voice cloning from a 60-second sample.",
        "included": [
          "80 premium voices in 18 languages",
          "Voice cloning from a 1-minute sample",
          "Emotion and pacing controls",
          "Pronunciation dictionary"
        ],
        "pros": [
          "Big quality jump over standard voices",
          "Cloning worked well on a clean sample"
        ],
        "cons": [
          "Cloning struggles with noisy audio"
        ],
        "score": 8.8,
        "takeaway": "The standard voices are the front end's weakest point. At $27 this is the best-value upsell in the funnel."
      },
      {
        "name": "Auto-Poster",
        "price": 37,
        "items": [
          "Schedule to TikTok, Reels, Shorts",
          "Bulk queue"
        ],
        "verdict": "skip",
        "note": "Free schedulers do the same job.",
        "link": "https://jvz1.com/c/123456/clipforge-ai/oto5",
        "summary": "Schedules finished videos to TikTok, Instagram Reels and YouTube Shorts from inside ClipForge.",
        "included": [
          "Connect up to 10 social accounts",
          "Bulk scheduling calendar",
          "Auto-generated captions and hashtags"
        ],
        "pros": [
          "Saves one export-and-upload step"
        ],
        "cons": [
          "Only three platforms",
          "Free tools do the same job"
        ],
        "score": 5.8,
        "takeaway": "It works, but free schedulers already cover this. Skip it."
      },
      {
        "name": "Reseller",
        "price": 97,
        "items": [
          "Keep 100% of sales",
          "50 licenses"
        ],
        "verdict": "skip",
        "note": "Rarely profitable for most buyers.",
        "link": "https://jvz1.com/c/123456/clipforge-ai/oto6",
        "summary": "Lets you sell ClipForge front-end licenses and keep 100% of the revenue, using the vendor's sales page.",
        "included": [
          "50 front-end licenses",
          "Done-for-you sales page",
          "Reseller dashboard"
        ],
        "pros": [
          "Sales page is ready to use"
        ],
        "cons": [
          "You compete with the vendor's own launch",
          "Licenses run out"
        ],
        "score": 4.9,
        "takeaway": "Rarely profitable unless you already have an audience. Most buyers should skip."
      },
      {
        "name": "Whitelabel",
        "price": 297,
        "items": [
          "Your brand and domain",
          "Set your own pricing"
        ],
        "verdict": "skip",
        "note": "For established agencies only.",
        "link": "https://jvz1.com/c/123456/clipforge-ai/oto7",
        "summary": "Rebrand ClipForge as your own app with your logo, domain and pricing.",
        "included": [
          "Custom domain and logo",
          "Set your own pricing",
          "Stripe integration",
          "Up to 500 users"
        ],
        "pros": [
          "Full rebrand, including emails"
        ],
        "cons": [
          "Expensive",
          "Customer support falls on you"
        ],
        "score": 5.2,
        "takeaway": "Only makes sense if you already have customers to sell a branded tool to."
      }
    ]
  },
  "features": [
    {
      "title": "Blog-to-video in one click",
      "benefit": "Paste a URL and get a 30–60s script, scenes and captions in about 90 seconds."
    },
    {
      "title": "Auto captions in 30 languages",
      "benefit": "Burned-in captions with word highlighting, editable before export."
    },
    {
      "title": "Stock + AI footage library",